Кофе и напитки,coffee, cappuccino, espresso, moka pot, coffeeholic
Кофе и напитки,latte art, flat white, turkish, caffeine, drink
Кофе и напитки,cup, mug, glass, milk, soy
Кофе и напитки,almond, pea, rice, hazelnut, oat
Кофе и напитки,oat milk, coconut, lactose, kefir, dairy
Коллажи и скрапбукинг,collage, scrapbook, scrapbooking, vision board, handmade
Коллажи и скрапбукинг,torn, cutout, patch, adhesive, frame
Коллажи и скрапбукинг,strip, album, tape, scotch, masking
Коллажи и скрапбукинг,torn paper, texture, pin, grid, paper
Дизайн и стиль,vector, illustration, design, graphic, typography
Дизайн и стиль,calligraphy, hand lettering, modern, retro, vintage
Дизайн и стиль,pop, grunge, gradient, stippling, stipple
Цветы и природа,flower, rose, botanical, nature, floral
Цветы и природа,plant, leaf, tree, delicate, spring
Обучение и канцелярия,journal, diary, planner, school, stationery
Обучение и канцелярия,notepad, education, lesson, classroom, quiz
Атмосфера и эмоции,trendy, inspirational, dreamy, feminine, good vibes
Атмосфера и эмоции,romance, nostalgia, calm, sweet, happy
Еда и кухня,food, restaurant, cafe, breakfast, menu
Еда и кухня,meal, kitchen, recipe, cook, cooking
Текст и надписи,quote, phrase, text, handwritten, hand lettering
Текст и надписи,embossed, lettering, inscription, speech, word
Путешествия и места,english, language, uk, england, london
Путешествия и места,bus, big ben, tourism, university, greece
Формы и элементы,crown, squared, cloud, circle, triangle
Формы и элементы,round, star, line, strip, shape
Люди и живое,bird, cat, girl, woman, man
Люди и живое,face, bust, figure, head, statue
Материалы и техника,paper, torn paper, tape, scotch, masking tape
Материалы и техника,cardboard, crayon, brush, ink, freehand
Маркетинг и реклама,advertising, sale, promotion, banner, packaging
Маркетинг и реклама,package, product, flyer, card, shop
Особые эффекты и стили,embossed, gritty, distressed, negative, macro
Особые эффекты и стили,glitch, bold, neon, brutal, techno
Цифровые элементы,png, file, template, icon, clip
Цифровые элементы,sticker, cutout, set, graphic set, collection
